{
  "session_id": "68888356-74b4-4638-9a07-3ca70c36e753",
  "transcript_path": "/home/user/.claude/projects/-home-user-project/68888356-74b4-4638-9a07-3ca70c36e753.jsonl",
  "cwd": "/home/user/project",
  "prompt_id": "cf149fb7-1892-4a58-ba53-4ae02fda7bcb",
  "permission_mode": "acceptEdits",
  "hook_event_name": "Stop",
  "stop_hook_active": false,
  "last_assistant_message": "Done. The command output `hello` and the file notes.txt has been created with the content `hi`.",
  "background_tasks": [],
  "session_crons": []
}
